POST DATE,VALUE DATE,REFERENCE,DEBIT AMT,CREDIT AMT,BALANCE,NARRATION
22-Nov-2024,22-Nov-2024,ACC-TRF001234,5000.00,,150000.00,NIP TRANSFER TO JOHN DOE REF:PSK_abc123
22-Nov-2024,22-Nov-2024,ACC-POS567890,,15000.50,165000.50,POS PURCHASE SHOPRITE
23-Nov-2024,23-Nov-2024,ACC-WEB789012,7500.00,,157500.50,WEB TRANSFER ORDER_1001 PAYMENT
23-Nov-2024,24-Nov-2024,ACC-MOB345678,,25000.00,182500.50,MOBILE TRANSFER FROM JANE SMITH
24-Nov-2024,24-Nov-2024,ACC-ATM901234,10000.00,,172500.50,ATM WITHDRAWAL LAGOS ISLAND
